{
  "receiptId": "1768000626919-afc02bd4099d",
  "intentId": "1768000626919-692cfcd58b7f",
  "createdAt": "2026-01-09T23:17:06.919556+00:00",
  "actorId": "<editor-id>",
  "run": {
    "runId": "local-1768000626919-03371009f69d",
    "runner": "mk2_alter.py",
    "os": "Windows/Linux/macOS",
    "cwd": "<repo-root>",
    "command": "python scripts/mk2_alter.py verify",
    "envSummary": {
      "python": "3.x"
    }
  },
  "checks": [
    {
      "name": "schema-validation",
      "status": "pass",
      "detail": "intent.schema.json validated"
    },
    {
      "name": "verification-command",
      "status": "pass",
      "detail": "project verify command succeeded"
    }
  ],
  "hashes": {
    "algorithm": "sha256",
    "manifest": [
      {
        "path": "governance/alteration-program/intent/<intentId>.json",
        "sha256": "<64-hex>"
      },
      {
        "path": "<changed-file>",
        "sha256": "<64-hex>"
      }
    ]
  },
  "result": "pass",
  "notes": "Example receipt; real receipts are generated by scripts."
}